Id,Text,Option1,Option2,Option3,Option4,Answer,Sure
701,Важные психологические особенности работоголика,Стремление заработать больше денег,"Компульсивное стремление к постоянному успеху и одобрению со стороны окружающих, страх потерпеть неудачу, «потерять лицо»","Вытеснение личных проблем заботами, связанными с профессиональной деятельностью",Стремление получить удовольствие от работы,2,0
690,Выберите один из критериев алкогольной зависимости,Формирование алкогольного абстинентного синдрома,Невозможность отказаться выпить в пьющей компании,Рвотный рефлекс на прием большой дозы спиртного,Прием алкоголя как способ снять стресс,0,FALSE
664,"Для выявления внутреннего потенциала клиента, терапевт ...",Актуализирует обиды клиента,Актуализирует скрытые способности,"Убеждает клиента, что всё получится",,1,FALSE
681,"""Консультант"" -  это позиция наряду с другими позициями гуманитария, независимо от образования..",Наряду с позицией Философа и Социолога,Наряду с позицией Историка и Педагога,Наряду с позицией Клиента и Заказчика,,0,0
668,Раскрытие семейных тайн в ходе терапии...,Является грубым нарушением границ клиента,Нарушает ход терапевтического процесса,Способствует осознаванию глубинных чувств клиентом,,2,TRUE
729,Основой для работы психолога в групповом консультировании является:,иммобилизация инициирующего и поддерживающего конфликт члена группы,система реальных отношений людей,нормализация состояния жертвы конфликта в группе,,1,FALSE
724,Что из перечисленного не является психосоматическим расстройством?,шизофрения,эссенциальная гипертония,сахарный диабет,,0,TRUE
722,"В отличие от психотерапии, психологическое консультирование",позволяет клиенту осознать свои возможности в решении проблем,по-новому посмотреть на себя и свои трудности,всё перечисленное,,2,TRUE
652,Формирование чувства защищенности у клиента происходит на этапе,установления контакта,принятия,стимулирования сознания,,1,FALSE
716,Выделите классический психосоматоз:,нервная анорексия,нейродермит,депрессия,,0,0
659,В ходе терапевтической беседы терапевту следует,"Обратить особое внимание на внешний вид клиента, его одежду, прическу и т.п.","Обратить особое внимание на манеру разговора клиента; на моменты, когда клиент бледнеет или краснеет; на позу клиента; на уровень энергичности клиента","Уделить особое внимание содержанию рассказа клиента, вспомнить аналогичные ситуации из практики",,1,TRUE
714,Психосоматические заболевания - это ...,канцерофобия,агорафобия,"физические болезни, причиной которых является стресс",,2,TRUE